Unnamed: 0	id	name	year	researchers	department	research_area	research_type	tokenized_title
0	1	ความสัมพันธ์ระหว่างบรรษัทภิบาลและความรับผิดชอบของธุรกิจต่อสังคม กับผลกระทบที่มีต่อมูลค่าร่วมของกิจการ: กรณีประเทศไทย	2556	เสกศักดิ์ จำเริญวงศ์ 	คณะพาณิชยศาสตร์และการบัญชี		การวิจัยประยุกต์	['ความ', 'สัมพันธ์', 'ระหว่าง', 'บรรษัทภิบาล', 'และ', 'ความ', 'รับผิดชอบ', 'ของ', 'ธุรกิจ', 'ต่อ', 'สังคม', ' ', 'กับ', 'ผล', 'กระทบ', 'ที่', 'มี', 'ต่อ', 'มูลค่า', 'ร่วม', 'ของ', 'กิจการ', ':', ' ', 'กรณี', 'ประเทศไทย']
1	2	การปกป้องพื้นที่เกษตรกรรมจากการเก็งกำไรราคาที่ดินในเขตเมือง	2556	อารยะ ปรีชาเมตตา 	คณะเศรษฐศาสตร์		การวิจัยประยุกต์	['การ', 'ปกป้อง', 'พื้นที่', 'เกษตรกรรม', 'จาก', 'การ', 'เก็ง', 'กำไร', 'ราคา', 'ที่ดิน', 'ใน', 'เขต', 'เมือง']
2	3	การประยุกต์ใช้ถ่านกัมมันต์เคลือบไทเทเนียมไดออกไซด์กับกังหันน้ำสำหรับการบำบัดน้ำเสียจากอุตสาหกรรมสิ่งทอ	2556	สายัณห์ ผุดวัฒน์ 	คณะวิทยาศาสตร์และเทคโนโลยี		การพัฒนาทดลอง	['การ', 'ประยุกต์', 'ใช้', 'ถ่าน', 'กัมมันต์', 'เคลือบไทเทเนียมไดออกไซด์', 'กับ', 'กังหัน', 'น้ำ', 'สำหรับ', 'การ', 'บำบัด', 'น้ำ', 'เสีย', 'จาก', 'อุตสาหกรรม', 'สิ่ง', 'ทอ']
3	4	การประยุกต์ใช้กระบวนการโซล-เจล เพื่อพัฒนาผ้าปิดแผลที่มีคุณสมบัติควบคุมการปลดปล่อยยาปฏิชีวนะ	2556	เพ็ญวิสาข์ พิสิฏฐศักดิ์ 	คณะวิทยาศาสตร์และเทคโนโลยี		การพัฒนาทดลอง	['การ', 'ประยุกต์', 'ใช้', 'กระบวน', 'การ', 'โซล', '-', 'เจล', ' ', 'เพื่อ', 'พัฒนา', 'ผ้า', 'ปิด', 'แผล', 'ที่', 'มี', 'คุณสมบัติ', 'ควบคุม', 'การ', 'ปลดปล่อย', 'ยา', 'ปฏิชีวนะ']
4	5	ผลกระทบของเงื่อนไขการเคลือบฟิล์มต่อสมบัติทางโครงสร้างและทางแสงของกระจกปรับเปลี่ยนสภาพแสงได้ด้วยฟิล์ม Mg-Ni ที่เตรียมด้วยเทคนิคดีซี แมกนีตรอน สปัตเตอริง	2556	กมล เอี่ยมพนากิจ 	คณะวิทยาศาสตร์และเทคโนโลยี		การพัฒนาทดลอง	['ผล', 'กระทบ', 'ของ', 'เงื่อนไข', 'การ', 'เคลือบ', 'ฟิล์ม', 'ต่อสมบัติ', 'ทาง', 'โครงสร้าง', 'และ', 'ทาง', 'แสง', 'ของ', 'กระจก', 'ปรับเปลี่ยน', 'สภาพ', 'แสง', 'ได้', 'ด้วย', 'ฟิล์ม', ' ', 'Mg', '-', 'Ni', ' ', 'ที่', 'เตรียม', 'ด้วย', 'เทคนิค', 'ดี', 'ซี', ' ', 'แมกนีตรอน', ' ', 'สปัตเตอริง']
5	6	การสังเคราะห์และวัดการนำไฟฟ้าของโพลิเมอร์อิเล็กโทรไลต์จากโพลิเอทิลีนไกลคอล เมทาคริเลตและสารเติมแต่งสำหรับเซลล์สุริยะแบบสีย้อม	2556	พีระศักดิ์ เภาประเสริฐ 	คณะวิทยาศาสตร์และเทคโนโลยี		การพัฒนาทดลอง	['การ', 'สังเคราะห์', 'และ', 'วัดการ', 'นำ', 'ไฟฟ้า', 'ของ', 'โพลิเมอร์อิเล็กโทรไลต์', 'จาก', 'โพลิเอทิลีนไกล', 'คอล', ' ', 'เมทา', 'คริเลต', 'และ', 'สารเติม', 'แต่ง', 'สำหรับ', 'เซลล์', 'สุริยะ', 'แบบ', 'สี', 'ย้อม']
6	7	การพัฒนาแผ่นฟิล์มจากแป้งข้าวเสริมสารสกัดจากสมุนไพรช่วยให้ปากสดชื่น	2556	สุธีรา วัฒนกุล 	คณะวิทยาศาสตร์และเทคโนโลยี		การวิจัยประยุกต์	['การ', 'พัฒนา', 'แผ่น', 'ฟิล์ม', 'จาก', 'แป้ง', 'ข้าวเสริมสาร', 'สกัด', 'จาก', 'สมุนไพร', 'ช่วย', 'ให้', 'ปากสด', 'ชื่น']
7	8	ยางธรรมชาติอิพอกซิไดซ์และออร์กาโนเคลย์คอมโพสิต : คุณสมบัติและการประยุกต์ใช้	2556	สุวดี ก้องพารากุล 	คณะวิทยาศาสตร์และเทคโนโลยี		การวิจัยประยุกต์	['ยาง', 'ธรรมชาติ', 'อิพอกซิไดซ์', 'และ', 'ออร์กาโนเคลย์คอมโพสิต', ' ', ':', ' ', 'คุณสมบัติ', 'และ', 'การ', 'ประยุกต์', 'ใช้']
8	9	การให้ผลผลิตของดอกพระจันทร์ (Ipomoea alba) และการสะสมสารต้านอนุมูลอิสระ	2556	ภาณุมาศ ฤทธิไชย 	คณะวิทยาศาสตร์และเทคโนโลยี		การวิจัยประยุกต์	['การ', 'ให้', 'ผล', 'ผลิต', 'ของ', 'ดอก', 'พระจันทร์', ' ', '(', 'Ipomoea', ' ', 'alba', ')', ' ', 'และ', 'การ', 'สะสม', 'สาร', 'ต้าน', 'อนุมูล', 'อิสระ']
9	10	การบำบัดสี Reactive จากน้ำเสียโรงงานสิ่งทอด้วยราที่แยกได้จากประเทศไทย	2556	นิรมล ศากยวงศ์ 	คณะวิทยาศาสตร์และเทคโนโลยี		การวิจัยประยุกต์	['การ', 'บำบัด', 'สี', ' ', 'Reactive', ' ', 'จาก', 'น้ำ', 'เสีย', 'โรง', 'งาน', 'สิ่ง', 'ทอ', 'ด้วย', 'รา', 'ที่', 'แยก', 'ได้', 'จาก', 'ประเทศไทย']
10	11	การออกแบบและสร้างอุปกรณ์ขนาดพกพาสำหรับติดตามคุณภาพบางพารามิเตอร์ที่สำคัญในแหล่งน้ำธรรมชาติ	2556	นภาพร ยังวิเศษ 	คณะวิทยาศาสตร์และเทคโนโลยี		การวิจัยประยุกต์	['การ', 'ออก', 'แบบ', 'และ', 'สร้าง', 'อุปกรณ์', 'ขนาด', 'พก', 'พา', 'สำหรับ', 'ติดตาม', 'คุณภาพ', 'บาง', 'พารามิเตอร์', 'ที่', 'สำคัญ', 'ใน', 'แหล่ง', 'น้ำ', 'ธรรมชาติ']
11	12	การออกแบบและพัฒนาอุปกรณ์ช่วยเดินสำหรับเด็กพิการทางสมอง	2556	บรรยงค์ รุ่งเรืองด้วยบุญ 	คณะวิศวกรรมศาสตร์		การพัฒนาทดลอง	['การ', 'ออก', 'แบบ', 'และ', 'พัฒนา', 'อุปกรณ์', 'ช่วย', 'เดิน', 'สำหรับ', 'เด็ก', 'พิการ', 'ทาง', 'สมอง']
12	13	งานวิจัยและพัฒนาเครื่องอบแห้งยางแท่งเชิงพาณิชย์โดยใช้พลังงานไมโครเวฟร่วมกับลมร้อน และอินฟราเรด และระบบลำเลียงอย่างต่อเนื่อง (ทฤษฎีและการสร้างนวัตกรรม)	2556	ผดุงศักดิ์ รัตนเดโช 	คณะวิศวกรรมศาสตร์		การวิจัยประยุกต์	['งานวิจัยและ', 'พัฒนา', 'เครื่อง', 'อบ', 'แห้ง', 'ยาง', 'แท่ง', 'เชิง', 'พาณิชย์', 'โดย', 'ใช้', 'พลังงาน', 'ไมโครเวฟ', 'ร่วม', 'กับ', 'ลม', 'ร้อน', ' ', 'และ', 'อินฟราเรด', ' ', 'และ', 'ระบบ', 'ลำเลียง', 'อย่าง', 'ต่อเนื่อง', ' ', '(', 'ทฤษฎี', 'และ', 'การ', 'สร้าง', 'นวัตกรรม', ')']
13	14	การปรับปรุงสมบัติการรับแรงกระแทกของพอลิแลคติกแอซิดโดยใช้ยางธรรมชาติปรับสภาพ	2556	แคทลียา ปัทมพรหม 	คณะวิศวกรรมศาสตร์		การวิจัยประยุกต์	['การ', 'ปรับปรุง', 'สมบัติ', 'การ', 'รับ', 'แรง', 'กระแทก', 'ของ', 'พอลิแลคติก', 'แอซิด', 'โดย', 'ใช้', 'ยาง', 'ธรรมชาติ', 'ปรับ', 'สภาพ']
14	15	การจำลองกระบวนการดูดซับแก๊ส VCM ที่ปนเปื้อนในแก๊สไฮโดรเจนบนถ่านกำมันต์ปรับสภาพ	2556	นุรักษ์ กฤษดานุรักษ์ 	คณะวิศวกรรมศาสตร์		การวิจัยประยุกต์	['การ', 'จำลอง', 'กระบวนการ', 'ดูดซับ', 'แก๊ส', ' ', 'VCM', ' ', 'ที่', 'ปนเปื้อน', 'ใน', 'แก๊ส', 'ไฮโดรเจน', 'บน', 'ถ่าน', 'กำมันต์ปรับ', 'สภาพ']
15	16	การศึกษาเชิงทฤษฎีและการทดลองของการสร้างลมหมุนวนแบบควงสว่านเพื่อเพิ่มประสิทธิภาพในกระบวนการอบแห้งแบบใช้ลมร้อนโดยใช้การควบคุมการไหลโดยวิธีอีเล็กโตรไฮโดรไดนามิกส์	2556	ไชยณรงค์ จักธรานนท์ 	คณะวิศวกรรมศาสตร์		การวิจัยประยุกต์	['การ', 'ศึกษา', 'เชิง', 'ทฤษฎี', 'และ', 'การ', 'ทดลอง', 'ของ', 'การ', 'สร้าง', 'ลม', 'หมุนวน', 'แบบ', 'ควง', 'สว่าน', 'เพื่อ', 'เพิ่ม', 'ประสิทธิภาพ', 'ใน', 'กระบวน', 'การ', 'อบ', 'แห้งแบบ', 'ใช้', 'ลมร้อน', 'โดย', 'ใช้', 'การ', 'ควบคุม', 'การ', 'ไหล', 'โดย', 'วิธี', 'อีเล็กโตรไฮโดรไดนามิกส์']
16	17	การขยายตัวของรอยร้าวล้าของเหล็กกล้าไร้สนิม 316L ขึ้นรูปด้วยการฉีดขึ้นรูปโลหะผง	2556	ชาวสวน กาญจโนมัย 	คณะวิศวกรรมศาสตร์		การวิจัยพื้นฐาน	['การ', 'ขยาย', 'ตัว', 'ของ', 'รอย', 'ร้าว', 'ล้า', 'ของ', 'เหล็ก', 'กล้า', 'ไร้', 'สนิม', ' ', '316', 'L', ' ', 'ขึ้น', 'รูป', 'ด้วย', 'การ', 'ฉีด', 'ขึ้น', 'รูป', 'โลหะ', 'ผง']
17	18	การศึกษาประสิทธิผลของสารสกัดตำรับเบญจกูลเพื่อใช้เป็นยารักษาผู้ป่วยโรคเรื้อรัง	2556	อรุณพร อิฐรัตน์ 	คณะแพทยศาสตร์		การวิจัยประยุกต์	['การ', 'ศึกษา', 'ประสิทธิผล', 'ของ', 'สาร', 'สกัด', 'ตำรับ', 'เบญจกูล', 'เพื่อ', 'ใช้', 'เป็น', 'ยา', 'รักษา', 'ผู้', 'ป่วย', 'โรค', 'เรื้อรัง']
18	19	การศึกษาเปรียบเทียบผลของ ทาม็อกซิเฟน ซิเตรท เทสโทสเตอโรน อันเดคาโนเอท และโฟเลท ต่อคุณภาพน้ำเชื้ออสุจิของคู่สมรสฝ่ายชายที่มีบุตรยากและมีความผิดปกติของน้ำเชื้ออสุจิ	2556	อาทิตย์ บุญยรางกูร 	คณะแพทยศาสตร์		การวิจัยประยุกต์	['การ', 'ศึกษา', 'เปรียบเทียบ', 'ผล', 'ของ', ' ', 'ทาม็อกซิเฟน ซิเตรท เทสโทสเตอโรน ', 'อัน', 'เดคาโนเอท ', 'และ', 'โฟเลท', ' ', 'ต่อ', 'คุณภาพ', 'น้ำ', 'เชื้ออสุจิ', 'ของ', 'คู่', 'สมรส', 'ฝ่าย', 'ชาย', 'ที่', 'มี', 'บุตร', 'ยาก', 'และ', 'มี', 'ความ', 'ผิด', 'ปกติ', 'ของ', 'น้ำ', 'เชื้อ', 'อสุจิ']
19	20	โปรตีนในสารคัดหลั่ง cystatin ขนาด 170 กิโลดาลตัน ของพยาธิใบไม้ตับชนิด Fasciola gigantica กับการศึกษาหน้าที่ในการกระตุ้น specific cellular pathways ใน mammalian host และหน้าที่ทางชีววิทยาเพื่อความอยู่รอดของพยาธิ	2556	ฮานส์ รูดี กรามส์ 	คณะสหเวชศาสตร์		การพัฒนาทดลอง	['โปรตีน', 'ใน', 'สาร', 'คัดหลั่ง', ' ', 'cystatin', ' ', 'ขนาด', ' ', '170', ' ', 'กิโลดาลตัน', ' ', 'ของ', 'พยาธิ', 'ใบ', 'ไม้', 'ตับ', 'ชนิด', ' ', 'Fasciola gigantica', ' ', 'กับ', 'การ', 'ศึกษา', 'หน้าที่', 'ใน', 'การ', 'กระตุ้น', ' ', 'specific', ' ', 'cellular', ' ', 'pathways', ' ', 'ใน', ' ', 'mammalian', ' ', 'host', ' ', 'และ', 'หน้าที่', 'ทาง', 'ชีววิทยา', 'เพื่อ', 'ความ', 'อยู่', 'รอด', 'ของ', 'พยาธิ']
20	21	โครงการวิจัยและพัฒนาหุ่นยนต์เพื่อช่วยในการฝึกเดินด้วยการช่วยพยุงน้ำหนักบางส่วนในผู้ป่วยโรคหลอดเลือดสมอง	2556	พัชรี คุณค้ำชู 	คณะสหเวชศาสตร์		การพัฒนาทดลอง	['โครงการวิจัย', 'และ', 'พัฒนา', 'หุ่นยนต์', 'เพื่อ', 'ช่วย', 'ใน', 'การ', 'ฝึก', 'เดิน', 'ด้วย', 'การ', 'ช่วย', 'พยุง', 'น้ำหนัก', 'บาง', 'ส่วน', 'ใน', 'ผู้', 'ป่วย', 'โรค', 'หลอด', 'เลือด', 'สมอง']
21	22	การเพิ่มจำนวนยีน การศึกษาคุณลักษณะและความสำคัญของลำดับกรดอะมิโนของยีนเพ็ปไทด์ Defensin ชนิดใหม่จากพืชหรือสัตว์ที่พบในประเทศไทย	2556	รัชนีวรรณ อุ่นแพทย์ 	คณะสหเวชศาสตร์		การวิจัยประยุกต์	['การ', 'เพิ่ม', 'จำนวน', 'ยีน', ' ', 'การ', 'ศึกษา', 'คุณลักษณะ', 'และ', 'ความ', 'สำคัญ', 'ของ', 'ลำดับ', 'กรด', 'อะมิโน', 'ของ', 'ยีนเพ็ปไทด์', ' ', 'Defensin', ' ', 'ชนิด', 'ใหม่', 'จาก', 'พืช', 'หรือ', 'สัตว์', 'ที่', 'พบ', 'ใน', 'ประเทศไทย']
22	23	ผลของสารบริสุทธิ์ torvoside ที่สกัดจากผลมะเขือพวงต่อการเปลี่ยนแปลงเป็นเซลล์ไขมัน (adipogenesis) และการสังเคราะห์ adiponectin ในเซลล์ไขมัน (3T3-L1)	2556	พิไลวรรณ ศิริพฤกษ์พงษ์ 	คณะสหเวชศาสตร์		การวิจัยประยุกต์	['ผล', 'ของ', 'สาร', 'บริสุทธิ์', ' ', 'torvoside', ' ', 'ที่', 'สกัด', 'จาก', 'ผล', 'มะเขือพวง', 'ต่อ', 'การ', 'เปลี่ยนแปลง', 'เป็น', 'เซลล์', 'ไขมัน', ' ', '(', 'adipogenesis', ')', ' ', 'และ', 'การ', 'สังเคราะห์', ' ', 'adiponectin', ' ', 'ใน', 'เซลล์', 'ไขมัน', ' ', '(', '3', 'T', '3', '-', 'L', '1', ')']
23	24	ผลกระทบของการติดเชื้อไวรัสตับอักเสบต่อความรุนแรงของการติดเชื้อไวรัสเอชไอวีในผู้ป่วยชาวไทยที่ได้รับยาต้านไวรัส	2556	จรีภรณ์ เอกวัฒน์ชัย 	คณะสหเวชศาสตร์		การวิจัยประยุกต์	['ผล', 'กระทบ', 'ของ', 'การ', 'ติด', 'เชื้อ', 'ไวรัส', 'ตับ', 'อักเสบ', 'ต่อ', 'ความ', 'รุนแรง', 'ของ', 'การ', 'ติด', 'เชื้อ', 'ไวรัส', 'เอชไอวี', 'ใน', 'ผู้', 'ป่วย', 'ชาว', 'ไทย', 'ที่', 'ได้', 'รับ', 'ยา', 'ต้าน', 'ไวรัส']
24	25	การพัฒนาเปปไทด์ต้านจุลชีพเพื่อใช้เป็น cytotoxic agent สำหรับมะเร็ง	2556	ธีรกุล อาภรณ์สุวรรณ 	คณะสหเวชศาสตร์		การวิจัยประยุกต์	['การ', 'พัฒนา', 'เปปไทด์', 'ต้าน', 'จุลชีพ', 'เพื่อ', 'ใช้', 'เป็น', ' ', 'cytotoxic', ' ', 'agent', ' ', 'สำหรับ', 'มะเร็ง']
25	26	ผลของลิพอพอลิแซ็กคาไรด์ชนิดต่างๆ ต่อการสร้าง MIP-3a/CCL20 ในเซลล์บุช่องปาก OKF6/TERT2 ที่เลี้ยงร่วมกับเซลล์โมโนไซต์ THP-1	2556	กมลพรรณ ภักดี 	คณะทันตแพทยศาสตร์		การวิจัยพื้นฐาน	['ผล', 'ของ', 'ลิพอ', 'พอลิแซ็กคาไรด์', 'ชนิด', 'ต่างๆ', ' ', 'ต่อ', 'การ', 'สร้าง', ' ', 'MIP', '-', '3', 'a', '/', 'CCL20', ' ', 'ใน', 'เซลล์', 'บุช่อง', 'ปาก', ' ', 'OKF6', '/', 'TERT2', ' ', 'ที่', 'เลี้ยง', 'ร่วม', 'กับ', 'เซลล์', 'โมโนไซต์', ' ', 'THP', '-', '1']
26	27	ผลของสารสกัดพรอโพลิสในประเทศไทยต่อการยึดเกาะของไบโอฟิล์มเชื้อก่อโรคฟันผุบนพื้นผิวไฮดรอกซี่อะพาไทต์ที่เคลือบด้วยน้ำลาย	2556	สิทธิชัย ขุนทองแก้ว 	คณะทันตแพทยศาสตร์		การวิจัยพื้นฐาน	['ผล', 'ของ', 'สาร', 'สกัด', 'พรอโพลิส', 'ใน', 'ประเทศไทย', 'ต่อ', 'การ', 'ยึดเกาะ', 'ของ', 'ไบโอฟิล์ม', 'เชื้อ', 'ก่อ', 'โรค', 'ฟัน', 'ผุ', 'บน', 'พื้น', 'ผิว', 'ไฮดรอกซี่', 'อะพาไทต์', 'ที่', 'เคลือบ', 'ด้วย', 'น้ำลาย']
27	28	ผลของวัสดุรองรับเซลล์ที่ย่อยสลายทางชีวภาพได้ชนิดแคลเซียมฟอสเฟต/พอลีเอสเตอร์ที่ตรึงด้วยเปปไทด์สายสั้นต่อเซลล์กระดูก	2556	สมหญิง พัฒน์ธีรพงศ์ 	คณะทันตแพทยศาสตร์		การวิจัยพื้นฐาน	['ผล', 'ของ', 'วัสดุ', 'รองรับ', 'เซลล์', 'ที่', 'ย่อยสลาย', 'ทาง', 'ชีวภาพ', 'ได้', 'ชนิด', 'แคลเซียม', 'ฟอสเฟต', '/', 'พอลีเอสเตอร์', 'ที่', 'ตรึง', 'ด้วย', 'เปป', 'ไทด์', 'สาย', 'สั้น', 'ต่อ', 'เซลล์', 'กระดูก']
28	29	การแปลความหมายเชิงประวัติศาสตร์ของเรือนพื้นถิ่นกลายรูปและ ผลิตใหม่: การขยายขอบเขตแหล่งท่องเที่ยวสู่อาคารระดับชาวบ้านที่มีความสำคัญทางวัฒนธรรม	2556	ภูมิชาย พันธุ์ไพโรจน์ 	คณะสถาปัตยกรรมศาสตร์และการผังเมือง		การวิจัยประยุกต์	['การ', 'แปล', 'ความหมาย', 'เชิง', 'ประวัติศาสตร์', 'ของ', 'เรือน', 'พื้นถิ่น', 'กลาย', 'รูป', 'และ', ' ', 'ผลิต', 'ใหม่', ':', ' ', 'การ', 'ขยาย', 'ขอบเขต', 'แหล่ง', 'ท่องเที่ยว', 'สู่', 'อาคาร', 'ระดับ', 'ชาว', 'บ้าน', 'ที่', 'มี', 'ความ', 'สำคัญ', 'ทาง', 'วัฒนธรรม']
