	Unnamed: 0	id	name	year	start_date	end_date	status	title	first_name	last_name	granter	tokenized_title
0	0	1	จัดทำแผนที่ภาษีและทะเบียนทรัพย์สิน องค์การบริหารส่วนตำบลลานกระบือ	2550	1/11/2007	4/10/2007	ปิดโครงการ	อาจารย์	เกษมชาต	ศรีวาลัย	อบต.ลานกระบือ	['จัดทำ', 'แผนที่', 'ภาษี', 'และ', 'ทะเบียน', 'ทรัพย์สิน', ' ', 'องค์การบริหารส่วนตำบลลานกระบือ']
1	1	2	จัดทำแผนที่ภาษีและทะเบียนทรัพย์สินเทศบาลตำบลลานกระบือ ระยะที่ 2	2550	11/24/2006	1/22/2007	ปิดโครงการ	อาจารย์	เกษมชาต	ศรีวาลัย	สำนักงานเทศบาลตำบลลานกระบือ	['จัดทำ', 'แผนที่', 'ภาษี', 'และ', 'ทะเบียน', 'ทรัพย์สิน', 'เทศบาลตำบลลาน', 'กระบือ', ' ', 'ระยะ', 'ที่', ' ', '2']
2	2	3	ศึกษาความเป็นไปได้ทางการตลาดและความต้องการนำไปประยุกต์ใช้งานต้นแบบผลงานวิจัยและพัฒนา ระบบเครือข่ายเซ็นเซอร์ไร้สายสำหรับการตรวจนับรถยนต์	2550	7/1/2007	11/30/2007	ปิดโครงการ	รองศาสตราจารย์ ดร.	เพ็ญแข	ศิริวรรณ	ศูนย์เทคโนโลยีอิเล็กทรอนิกส์และคอมพิวเตอร์แห่งชาติ	['ศึกษา', 'ความ', 'เป็น', 'ไป', 'ได้', 'ทาง', 'การ', 'ตลาด', 'และ', 'ความ', 'ต้องการ', 'นำ', 'ไป', 'ประยุกต์', 'ใช้', 'งาน', 'ต้น', 'แบบ', 'ผล', 'งาน', 'วิจัยและพัฒนา', ' ', 'ระบบ', 'เครือข่ายเซ็นเซอร์', 'ไร้', 'สาย', 'สำหรับ', 'การ', 'ตรวจ', 'นับ', 'รถ', 'ยนต์']
3	3	4	ประเมินผลการปฎิบัติงานของสำนักงาน กทช. จากบุคคลภายนอก	2550	4/2/2007	5/16/2007	ปิดโครงการ	รองศาสตราจารย์ ดร.	เพ็ญแข	ศิริวรรณ	คณะกรรมการกิจการกระจายเสียง กิจการโทรทัศน์ และกิจการโทรคมนาคมแห่งชาติ	['ประเมิน', 'ผล', 'การ', 'ปฎิบัติ', 'งาน', 'ของ', 'สำนักงาน กทช.', ' ', 'จาก', 'บุคคล', 'ภาย', 'นอก']
4	4	5	สำรวจพฤติกรรมและความต้องการใช้ทางหลวงพิเศษของผู้ใช้บริการทางหลวงพิเศษหมายเลข 7 และ 9	2550	3/2/2007	8/29/2007	ปิดโครงการ	รองศาสตราจารย์ ดร.	เพ็ญแข	ศิริวรรณ	สำนักงานทางหลวงพิเศษระหว่างเมือง	['สำรวจ', 'พฤติกรรม', 'และ', 'ความ', 'ต้องการ', 'ใช้', 'ทาง', 'หลวง', 'พิเศษ', 'ของ', 'ผู้', 'ใช้', 'บริการ', 'ทาง', 'หลวงพิเศษ', 'หมายเลข', ' ', '7', ' ', 'และ', ' ', '9']
5	5	6	ศึกษาพัฒนาการของหลักกฎหมายเลือกตั้งของประเทศไทยและต่างประเทศ	2550	9/27/2007	7/27/2008	ปิดโครงการ	ผู้ช่วยศาสตราจารย์ ดร.	เอกบุญ	วงศ์สวัสดิ์กุล	สำนักงานคณะกรรมการการเลือกตั้ง	['ศึกษา', 'พัฒนาการ', 'ของ', 'หลัก', 'กฎหมาย', 'เลือกตั้ง', 'ของ', 'ประเทศไทย', 'และ', 'ต่าง', 'ประเทศ']
6	6	7	ปรับปรุงกฎระเบียบที่เกี่ยวข้องในการดำเนินงาน ของสำนักงานพัฒนาเทคโนโลยีอวกาศและภูมิสารสนเทศ (องค์การมหาชน)	2550	1/15/2007	7/13/2007	ปิดโครงการ	ผู้ช่วยศาสตราจารย์ ดร.	เอกบุญ	วงศ์สวัสดิ์กุล	สำนักงานพัฒนาเทคโนโลยีอวกาศและภูมิสารสนเทศ (องค์การมหาชน) (GISTDA)	['ปรับปรุง', 'กฎระเบียบ', 'ที่', 'เกี่ยวข้อง', 'ใน', 'การ', 'ดำเนิน', 'งาน', ' ', 'ของ', 'สำนักงานพัฒนาเทคโนโลยี', 'อวกาศ', 'และ', 'ภูมิสารสนเทศ', ' ', '(', 'องค์การมหาชน', ')']
7	7	8	EBS Global Study Tour	2550	7/15/2007	7/18/2007	ปิดโครงการ	รองศาสตราจารย์ ดร.	แก้วตา	โรหิตรัตนะ	European Businessw School (EBS)	['EBS', ' ', 'Global', ' ', 'Study', ' ', 'Tour']
8	8	9	BLKL Lapping Lubricant Characterization	2550	5/30/2007	10/1/2007	ปิดโครงการ	ผู้ช่วยศาสตราจารย์ ดร.	แคทลียา	ปัทมพรหม	บริษัท เวสเทิร์น ดิจิตอล (ประเทศไทย) จำกัด	['BLKL', ' Lapping', ' ', 'Lubricant ', 'Characterization']
9	9	10	ศึกษาพันธกรณีและความพร้อมของประเทศไทยในการปฏิบัติตามอนุสัญญาสหประชาชาติว่าด้วยการต่อต้านการทุจริต ค.ศ.2003	2550	9/19/2007	9/19/2008	ปิดโครงการ	ศาสตราจารย์	แสวง	บุญเฉลิมวิภาส	สำนักงานคณะกรรมการป้องกันและปราบปรามการทุจริตแห่งชาติ	['ศึกษา', 'พันธกรณี', 'และ', 'ความ', 'พร้อม', 'ของ', 'ประเทศไทย', 'ใน', 'การ', 'ปฏิบัติ', 'ตาม', 'อนุสัญญา', 'สหประชาชาติ', 'ว่า', 'ด้วย', 'การ', 'ต่อต้าน', 'การ', 'ทุจริต', ' ', 'ค.ศ.', '2003']
10	10	11	ประเมินผลโครงการศูนย์ต้อนรับผู้ร่วมสร้างสันติสุข 3 จังหวัดชายแดนภาคใต้	2550	6/25/2007	10/24/2007	ปิดโครงการ	รองศาสตราจารย์ ดร.	โกวิทย์	พวงงาม	กรมคุ้มครองสิทธิและเสรีภาพ	['ประเมิน', 'ผล', 'โครงการ', 'ศูนย์', 'ต้อนรับ', 'ผู้', 'ร่วม', 'สร้าง', 'สันติสุข', ' ', '3', ' ', 'จังหวัด', 'ชาย', 'แดน', 'ภาค', 'ใต้']
11	11	12	ติดตามประเมินผลโครงการประชาศึกษาและชุมชนสัมพันธ์	2550	9/14/2007	2/14/2008	ปิดโครงการ	รองศาสตราจารย์ ดร.	โกวิทย์	พวงงาม	สำนักงานคณะกรรมการป้องกันและปราบปรามการทุจริตแห่งชาติ	['ติดตาม', 'ประเมิน', 'ผล', 'โครงการ', 'ประชาศึกษา', 'และ', 'ชุมชนสัมพันธ์']
12	12	13	ฝึกอบรมหลักสูตรการบริหารจัดการในสถานการณ์วิกฤติของกรุงเทพมหานคร	2550	5/3/2007	5/25/2007	ปิดโครงการ	รองศาสตราจารย์ ดร.	โคริน	เฟื่องเกษม	ศาลาว่าการกรุงเทพมหานคร	['ฝึกอบรม', 'หลักสูตร', 'การ', 'บริหารจัดการ', 'ใน', 'สถานการณ์', 'วิกฤติ', 'ของ', 'กรุงเทพมหานคร']
13	13	14	อบรมและศึกษาดูงานหลักสูตรการพัฒนาภาวะผู้นำที่จำเป็นในสถานการณ์บ้านเมืองในปัจจุบัน	2550	8/20/2007	8/22/2007	ปิดโครงการ	รองศาสตราจารย์ ดร.	โคริน	เฟื่องเกษม	องค์การบริหารส่วนจังหวัดนครราชสีมา	['อบรม', 'และ', 'ศึกษา', 'ดู', 'งาน', 'หลักสูตร', 'การ', 'พัฒนา', 'ภาวะ', 'ผู้', 'นำ', 'ที่', 'จำเป็น', 'ใน', 'สถานการณ์', 'บ้านเมือง', 'ใน', 'ปัจจุบัน']
14	14	15	จัดทำมาตรฐานคุณภาพสิ่งแวดล้อมธรรมชาติและสิ่งแวดล้อมศิลปกรรม: เมืองเก่า ภายใต้โครงการบริหารจัดการและฟื้นฟูสิ่งแวดล้อมธรรมชาติและศิลปกรรม	2550	3/3/2007	10/28/2007	ปิดโครงการ	รองศาสตราจารย์	โรจน์	คุณเอนก	สำนักงานนโยบายและแผนทรัพยากรธรรมชาติและสิ่งแวดล้อม	['จัดทำ', 'มาตรฐาน', 'คุณภาพ', 'สิ่ง', 'แวดล้อม', 'ธรรมชาติ', 'และสิ่งแวดล้อม', 'ศิลปกรรม', ':', ' ', 'เมืองเก่า', ' ', 'ภาย', 'ใต้', 'โครงการ', 'บริหารจัดการ', 'และ', 'ฟื้นฟู', 'สิ่ง', 'แวดล้อม', 'ธรรมชาติ', 'และ', 'ศิลปกรรม']
15	15	16	พัฒนาผู้บริหารระดับกลาง หลักสูตร พัฒนานักบริหารระดับกลาง : Executive Micro MPA	2550	3/21/2007	4/12/2007	ปิดโครงการ	รองศาสตราจารย์ ดร.	ไตรรัตน์	โภคพลากรณ์	กรมการจัดหางาน	['พัฒนา', 'ผู้', 'บริหาร', 'ระดับ', 'กลาง', ' ', 'หลักสูตร', ' ', 'พัฒนา', 'นัก', 'บริหาร', 'ระดับ', 'กลาง', ' ', ':', ' ', 'Executive', ' ', 'Micro', ' ', 'MPA']
16	16	17	ฝึกอบรมหลักสูตรนักบริหารระดับต้น รุ่นที่ 17	2550	7/5/2007	7/27/2007	ปิดโครงการ	รองศาสตราจารย์ ดร.	ไตรรัตน์	โภคพลากรณ์	กรมสรรพสามิต	['ฝึกอบรม', 'หลักสูตร', 'นัก', 'บริหาร', 'ระดับ', 'ต้น', ' ', 'รุ่น', 'ที่', ' ', '17']
17	17	18	ฝึกอบรมหลักสูตรนักบริหารระดับต้น รุ่นที่ 15	2550	5/14/2007	6/6/2007	ปิดโครงการ	รองศาสตราจารย์ ดร.	ไตรรัตน์	โภคพลากรณ์	กรมสรรพสามิต	['ฝึกอบรม', 'หลักสูตร', 'นัก', 'บริหาร', 'ระดับ', 'ต้น', ' ', 'รุ่น', 'ที่', ' ', '15']
18	18	19	ฝึกอบรมหลักสูตรนักบริหารระดับต้น รุ่นที่ 16	2550	6/11/2007	7/3/2007	ปิดโครงการ	รองศาสตราจารย์ ดร.	ไตรรัตน์	โภคพลากรณ์	กรมสรรพสามิต	['ฝึกอบรม', 'หลักสูตร', 'นัก', 'บริหาร', 'ระดับ', 'ต้น', ' ', 'รุ่น', 'ที่', ' ', '16']
19	19	20	จัดทำหลักเกณฑ์และวิธีการประเมินผลการปฏิบัติงานและการประเมินค่างานเพื่อกำหนดโครงสร้างอัตราเงินเดือนพนักงานสายปฏิบัติการวิชาชีพและปฏิบัติการทั่วไป รวมถึงตำแหน่งทางวิชาการ	2550	7/9/2007	9/30/2007	ปิดโครงการ	รองศาสตราจารย์ ดร.	ไตรรัตน์	โภคพลากรณ์	สถาบันพระปกเกล้า	['จัดทำ', 'หลักเกณฑ์', 'และ', 'วิธี', 'การ', 'ประเมิน', 'ผล', 'การ', 'ปฏิบัติ', 'งาน', 'และ', 'การ', 'ประเมิน', 'ค่า', 'งาน', 'เพื่อ', 'กำหนด', 'โครงสร้าง', 'อัตรา', 'เงิน', 'เดือน', 'พนักงาน', 'สายปฏิบัติการ', 'วิชาชีพ', 'และ', 'ปฏิบัติการ', 'ทั่วไป', ' ', 'รวม', 'ถึง', 'ตำแหน่ง', 'ทาง', 'วิชาการ']
20	20	21	ฝึกอบรมตามแผน Competency Base Traning Plan และแผนการพัฒนาผู้นำการเปลี่ยนแปลงสำนักเลขาธิการคณะรัฐมนตรี ประจำปี 2550	2550	7/11/2007	9/28/2007	ปิดโครงการ	รองศาสตราจารย์ ดร.	ไตรรัตน์	โภคพลากรณ์	สำนักเลขาธิการคณะรัฐมนตรี	['ฝึกอบรม', 'ตาม', 'แผน', ' ', 'Competency', ' ', 'Base', ' ', 'Traning', ' ', 'Plan', ' ', 'และ', 'แผน', 'การ', 'พัฒนา', 'ผู้', 'นำ', 'การ', 'เปลี่ยนแปลง', 'สำนักเลขาธิการ', 'คณะ', 'รัฐมนตรี', ' ', 'ประจำ', 'ปี', ' ', '2550']
21	21	22	ฝึกอบรมหลักสูตรเสริมสร้างสมรรถนะคณะผู้บริหารการคลังประจำจังหวัด รุ่นที่ 1	2550	11/8/2006	11/17/2006	ปิดโครงการ	รองศาสตราจารย์ ดร.	ไตรรัตน์	โภคพลากรณ์	สำนักงานเศรษฐกิจการคลัง กระทรวงการคลัง	['ฝึกอบรม', 'หลักสูตร', 'เสริมสร้าง', 'สมรรถนะ', 'คณะ', 'ผู้', 'บริหาร', 'การ', 'คลัง', 'ประจำ', 'จังหวัด', ' ', 'รุ่น', 'ที่', ' ', '1']
22	22	23	ฝึกอบรมหลักสูตรเสริมสร้างสมรรถนะคณะผู้บริหารการคลังประจำจังหวัด รุ่นที่ 2	2550	11/8/2006	11/17/2006	ปิดโครงการ	รองศาสตราจารย์ ดร.	ไตรรัตน์	โภคพลากรณ์	สำนักงานเศรษฐกิจการคลัง กระทรวงการคลัง	['ฝึกอบรม', 'หลักสูตร', 'เสริมสร้าง', 'สมรรถนะ', 'คณะ', 'ผู้', 'บริหาร', 'การ', 'คลัง', 'ประจำ', 'จังหวัด', ' ', 'รุ่น', 'ที่', ' ', '2']
23	23	24	ฝึกอบรมหลักสูตรนักบริหารแรงงานระดับกลาง (นบก.) รุ่นที่ 9	2550	8/27/2007	9/21/2007	ปิดโครงการ	รองศาสตราจารย์ ดร.	ไตรรัตน์	โภคพลากรณ์	สำนักงานปลัดกระทรวงแรงงาน	['ฝึกอบรม', 'หลักสูตร', 'นัก', 'บริหาร', 'แรงงาน', 'ระดับ', 'กลาง', ' ', '(', 'นบก.', ')', ' ', 'รุ่น', 'ที่', ' ', '9']
24	24	25	จัดทำหลักเกณฑ์และวิธีการประเมินผลการปฏิบัติงานพนักงานและการประเมินผลภาพรวมของแต่ละส่วนงาน	2550	12/1/2006	2/28/2007	ปิดโครงการ	รองศาสตราจารย์ ดร.	ไตรรัตน์	โภคพลากรณ์	สำนักพิมพ์คณะรัฐมนตรีและราชกิจจานุเบกษา	['จัดทำ', 'หลักเกณฑ์', 'และ', 'วิธี', 'การ', 'ประเมิน', 'ผล', 'การ', 'ปฏิบัติ', 'งาน', 'พนักงาน', 'และ', 'การ', 'ประเมิน', 'ผล', 'ภาพ', 'รวม', 'ของ', 'แต่ละ', 'ส่วน', 'งาน']
25	25	26	ศึกษาภาพอนาคตการพัฒนาและคุ้มครองพิทักษ์สิทธิผู้ด้อยโอกาส	2550	5/2/2007	2/26/2008	ปิดโครงการ	อาจารย์ ดร.	ไพรัช	บวรสมพงษ์	สำนักงานส่งเสริมสวัสดิภาพและพิทักษ์เด็ก เยาวชน ผู้ด้อยโอกาส คนพิการและผู้สูงอายุ	['ศึกษา', 'ภาพ', 'อนาคต', 'การ', 'พัฒนา', 'และ', 'คุ้มครอง', 'พิทักษ์', 'สิทธิ', 'ผู้', 'ด้อย', 'โอกาส']
26	26	27	ดำเนินกิจกรรมประเมินผลการดำเนินงานแผนชุมชน ตามโครงการแผนชุมชนพึ่งตนเอง	2550	9/25/2007	3/25/2008	ปิดโครงการ	ผู้ช่วยศาสตราจารย์	กมลทิพย์	แจ่มกระจ่าง	สำนักพัฒนาสังคม กรุงเทพมหานคร	['ดำเนิน', 'กิจกรรม', 'ประเมิน', 'ผล', 'การ', 'ดำเนิน', 'งาน', 'แผน', 'ชุมชน', ' ', 'ตาม', 'โครงการ', 'แผน', 'ชุมชน', 'พึ่งตน', 'เอง']
27	27	28	สำรวจค่าใช้จ่ายและบุคลากรทางการวิจัยและพัฒนาของภาคอุดมศึกษาปี 2550	2550	6/5/2007	1/5/2008	ปิดโครงการ	อาจารย์ ดร.	กวีพงษ์ 	เลิศวัชรา	สำนักงานคณะกรรมการวิจัยแห่งชาติ(วช.)	['สำรวจ', 'ค่า', 'ใช้จ่าย', 'และ', 'บุคลากร', 'ทาง', 'การ', 'วิจัย', 'และพัฒนา', 'ของ', 'ภาค', 'อุดมศึกษา', 'ปี', ' ', '2550']
28	28	29	สำรวจความพึงพอใจของผู้มีส่วนได้เสีย จากการบริหารงานกองทุนสิ่งแวดล้อม ตามระบบการประเมินผลทุนหมุนเวียน ปี 2550	2550	1/17/2007	10/13/2007	ปิดโครงการ	อาจารย์ ดร.	กวีพงษ์ 	เลิศวัชรา	สำนักงานนโยบายและแผนทรัพยากรธรรมชาติและสิ่งแวดล้อม	['สำรวจ', 'ความ', 'พึงพอใจ', 'ของ', 'ผู้', 'มี', 'ส่วน', 'ได้', 'เสีย', ' ', 'จาก', 'การ', 'บริหาร', 'งาน', 'กองทุนสิ่งแวดล้อม', ' ', 'ตาม', 'ระบบ', 'การ', 'ประเมิน', 'ผล', 'ทุน', 'หมุนเวียน', ' ', 'ปี', ' ', '2550']
29	29	30	ประเมินผลสัมฤทธ์การส่งเสริมและพัฒนาอุตสาหกรรมไทยและวิสาหกิจชุมชนให้ได้มาตรฐาน ปีงบประมาณ 2550	2550	4/2/2007	6/30/2008	ปิดโครงการ	อาจารย์ ดร.	กวีพงษ์ 	เลิศวัชรา	สำนักงานมาตรฐานผลิตภัณฑ์อุตสาหกรรม	['ประเมิน', 'ผล', 'สัมฤทธ์', 'การ', 'ส่งเสริม', 'และพัฒนา', 'อุตสาหกรรม', 'ไทย', 'และ', 'วิสาหกิจ', 'ชุมชน', 'ให้', 'ได้', 'มาตรฐาน', ' ', 'ปี', 'งบ', 'ประมาณ', ' ', '2550']
30	30	31	ศึกษาวิจัยการนำมาตรฐานไปใช้ของผู้ประกอบการและผู้บริโภค	2550	1/9/2007	5/8/2007	ปิดโครงการ	อาจารย์ ดร.	กวีพงษ์ 	เลิศวัชรา	สำนักงานมาตรฐานผลิตภัณฑ์อุตสาหกรรม	['ศึกษา', 'วิจัย', 'การ', 'นำ', 'มาตรฐาน', 'ไป', 'ใช้', 'ของ', 'ผู้', 'ประกอบ', 'การ', 'และ', 'ผู้', 'บริโภค']
31	31	32	ศึกษาแนวทางเพื่อส่งเสริมภาพลักษณ์สำนักงานมาตรฐานผลิตภัณฑ์อุตสาหกรรม	2550	9/20/2007	3/17/2008	ปิดโครงการ	อาจารย์ ดร.	กวีพงษ์ 	เลิศวัชรา	สำนักงานมาตรฐานผลิตภัณฑ์อุตสาหกรรม	['ศึกษา', 'แนวทาง', 'เพื่อ', 'ส่งเสริม', 'ภาพลักษณ์', 'สำนักงานมาตรฐาน', 'ผลิตภัณฑ์', 'อุตสาหกรรม']
32	32	33	ตรวจหาและวิเคราะห์เชื้อโคลิฟอร์มแบคทีเรียโดยใช้น้ำยา (IS-2)	2550	3/1/2007	3/30/2007	ปิดโครงการ	ผู้ช่วยศาสตราจารย์	กำพล	นันทพงษ์	กองงานศูนย์รังสิต	['ตรวจ', 'หา', 'และ', 'วิเคราะห์', 'เชื้อ', 'โคลิฟอร์ม', 'แบคทีเรีย', 'โดย', 'ใช้', 'น้ำยา', ' ', '(', 'I', 'S', '-', '2', ')']
33	33	34	ตรวจวิเคราะห์น้ำ	2550	2/20/2007	3/14/2007	ปิดโครงการ	ผู้ช่วยศาสตราจารย์	กำพล	นันทพงษ์	คณะวิศวกรรมศาสตร์ มหาวิทยาลัยธรรมศาสตร ศูนย์รังสิต	['ตรวจ', 'วิเคราะห์', 'น้ำ']
