Unnamed: 0	id	name	year	researchers	department	research_area	research_type	tokenized_title
236	237	ทุนทางสังคมกับการเสริมสร้างการปกครองท้องถิ่น: การศึกษาเปรียบเทียบประเทศไทย-ญี่ปุ่น-เกาหลีใต้	2556	รศ. สายฝน สุเอียนทรเมธี	สถาบันสัญญา ธรรมศักดิ์ เพื่อประชาธิปไตย			['ทุน', 'ทาง', 'สังคม', 'กับ', 'การ', 'เสริมสร้าง', 'การ', 'ปกครอง', 'ท้องถิ่น', ':', ' ', 'การ', 'ศึกษา', 'เปรียบเทียบ', 'ประเทศไทย', '-', 'ญี่ปุ่น', '-', 'เกาหลีใต้']
237	238	การพัฒนาการท่องเที่ยวเพื่อการเรียนรู้ที่มีพิพิธภัณฑ์เป็นศูนย์กลางในจังหวัดปทุมธานี	2556	นายอิสรา อุปถัมภ์	สถาบันไทยคดีศึกษา			['การ', 'พัฒนา', 'การ', 'ท่องเที่ยว', 'เพื่อ', 'การ', 'เรียนรู้', 'ที่', 'มี', 'พิพิธภัณฑ์', 'เป็น', 'ศูนย์กลาง', 'ใน', 'จังหวัดปทุมธานี']
238	239	การพัฒนาสถาบันอุดมศึกษาของไทยเพื่อรองรับการเคลื่อนย้ายแรงงานที่มีทักษะในหมู่ประเทศกลุ่มอาเซียนภายใต้กรอบประชาคมเศรษฐกิจอาเซียน	2556	รศ.ดร. สมชาย สุขสิริเสรีกุล	สถาบันทรัพยากรมนุษย์			['การ', 'พัฒนา', 'สถาบัน', 'อุดมศึกษา', 'ของ', 'ไทย', 'เพื่อ', 'รองรับ', 'การ', 'เคลื่อนย้าย', 'แรงงาน', 'ที่', 'มี', 'ทักษะ', 'ใน', 'หมู่', 'ประเทศ', 'กลุ่มอาเซียน', 'ภาย', 'ใต้', 'กรอบ', 'ประชาคม', 'เศรษฐกิจ', 'อาเซียน']
239	240	การศึกษาชีววิทยาระดับโมเลกุลของจีน pfmrp1 และ pfhdac1 ต่อการดื้อยาอาร์ติซูเนตและเมฟโฟลควินของเชื้อมาลาเรียชนิดฟัลซิพารัม	2556	อ.ดร. วรรณา ชัยเจริญกุล	ศูนย์วิจัยค้นคว้าและพัฒนายา			['การ', 'ศึกษา', 'ชีววิทยา', 'ระดับ', 'โมเลกุล', 'ของ', 'จีน', ' ', 'pfmrp', '1', ' ', 'และ', ' ', 'pfhdac', '1', ' ', 'ต่อ', 'การ', 'ดื้อยาอาร์ติซูเนต', 'และ', 'เมฟโฟลควิน', 'ของ', 'เชื้อมาลาเรีย', 'ชนิด', 'ฟัลซิพารัม']
240	241	ปฏิกิริยาทางเภสัชจลนศาสตร์ระหว่างกันและเภสัชพันธุศาสตร์ของยาต้านมาลาเรียและยาต้านไวรัสเอชไอวีกลุ่มยับยั้งโปรตีนเมื่อได้รับร่วมกันในอาสาสมัครชาวไทยที่มีสุขภาพสมบูรณ์	2556	ศ.ดร. เกศรา ณ บางช้าง	ศูนย์วิจัยค้นคว้าและพัฒนายา			['ปฏิกิริยา', 'ทาง', 'เภสัชจลนศาสตร์', 'ระหว่าง', 'กัน', 'และ', 'เภสัชพันธุศาสตร์', 'ของ', 'ยา', 'ต้าน', 'มาลาเรีย', 'และ', 'ยา', 'ต้าน', 'ไวรัส', 'เอชไอวี', 'กลุ่ม', 'ยับยั้ง', 'โปรตีน', 'เมื่อ', 'ได้', 'รับ', 'ร่วม', 'กัน', 'ใน', 'อาสา', 'สมัคร', 'ชาว', 'ไทย', 'ที่', 'มี', 'สุขภาพ', 'สมบูรณ์']
241	242	การพัฒนารูปแบบการสอนการเขียนภาษาอังกฤษเพื่อพัฒนาศักยภาพการเขียนภาษาอังกฤษและปลูกสร้างคุณลักษณะทางอัตลักษณ์ของนักศึกษามหาวิทยาลัยธรรมศาสตร์เพื่อเตรียมความพร้อมการเข้าสู่ประชาคมอาเซียน	2557	ผศ.ดร. เสน่ห์ ทองรินทร์	คณะศิลปศาสตร์			['การ', 'พัฒนา', 'รูปแบบ', 'การ', 'สอน', 'การ', 'เขียน', 'ภาษา', 'อังกฤษ', 'เพื่อ', 'พัฒนา', 'ศักยภาพ', 'การ', 'เขียน', 'ภาษา', 'อังกฤษ', 'และ', 'ปลูกสร้าง', 'คุณลักษณะ', 'ทาง', 'อัตลักษณ์', 'ของ', 'นัก', 'ศึกษา', 'มหาวิทยาลัยธรรมศาสตร์', 'เพื่อ', 'เตรียม', 'ความ', 'พร้อม', 'การ', 'เข้า', 'สู่', 'ประชาคมอาเซียน']
242	243	การจัดการความรู้การนิเทศงานสังคมสงเคราะห์	2557	ผศ.ดร. พงษ์เทพ สันติกุล	คณะสังคมสงเคราะห์ศาสตร์			['การ', 'จัดการ', 'ความ', 'รู้', 'การ', 'นิเทศงาน', 'สังคมสงเคราะห์']
243	244	กรอบการสร้างสภาพแวดล้อมการทำงานเชิงสร้างสรรค์และการสร้างนวัตกรรมในศตวรรษที่ 21 : กรณีศึกษาองค์กรธุรกิจสร้างสรรค์ในประเทศไทย	2557	อ.ดร. ทิพย์สุดา จันทร์แจ่มหล้า	คณะสถาปัตยกรรมศาสตร์และการผังเมือง			['กรอบ', 'การ', 'สร้าง', 'สภาพ', 'แวดล้อม', 'การ', 'ทำ', 'งาน', 'เชิง', 'สร้างสรรค์', 'และ', 'การ', 'สร้าง', 'นวัตกรรม', 'ใน', 'ศตวรรษ', 'ที่', ' ', '21', ' ', ':', ' ', 'กรณี', 'ศึกษา', 'องค์กร', 'ธุรกิจ', 'สร้างสรรค์', 'ใน', 'ประเทศไทย']
244	245	การศึกษาดัชนีการใช้พลังงานในอาคาร : กรณีศึกษาโชว์รูมและศูนย์บริการรถยนต์ในประเทศไทย	2557	อ. กรกมล ตันติวนิช	คณะสถาปัตยกรรมศาสตร์และการผังเมือง			['การ', 'ศึกษา', 'ดัชนี', 'การ', 'ใช้', 'พลังงาน', 'ใน', 'อาคาร', ' ', ':', ' ', 'กรณี', 'ศึกษา', 'โชว์', 'รูม', 'และ', 'ศูนย์', 'บริการ', 'รถ', 'ยนต์', 'ใน', 'ประเทศไทย']
245	246	อยู่กับน้ำ-ถอดรหัสวิถีท้องถิ่นการสร้างบ้านแปลงเมือง : กรณีศึกษาพื้นที่ลุ่มน้ำภาคกลาง	2557	อ. รุ่งรัตน์ เต็งเก้าประเสริฐ	คณะสถาปัตยกรรมศาสตร์และการผังเมือง			['อยู่', 'กับ', 'น้ำ', '-', 'ถอด', 'รหัส', 'วิถี', 'ท้องถิ่น', 'การ', 'สร้าง', 'บ้านแปลง', 'เมือง', ' ', ':', ' ', 'กรณี', 'ศึกษา', 'พื้นที่', 'ลุ่มน้ำภาคกลาง']
246	247	การพัฒนาผลิตภัณฑ์ชีวภาพสำหรับย่อยสลายฟางข้าวและควบคุมโรคขอบใบแห้งและใบขีดโปร่งแสงในระบบการผลิตข้าวอินทรีย์	2557	อ.ดร. ดุสิต อธินุวัฒน์	คณะวิทยาศาสตร์และเทคโนโลยี			['การ', 'พัฒนา', 'ผลิตภัณฑ์', 'ชีวภาพ', 'สำหรับ', 'ย่อย', 'สลาย', 'ฟาง', 'ข้าว', 'และ', 'ควบคุม', 'โรค', 'ขอบ', 'ใบ', 'แห้ง', 'และ', 'ใบ', 'ขีด', 'โปร่ง', 'แสง', 'ใน', 'ระบบ', 'การ', 'ผลิต', 'ข้าว', 'อินทรีย์']
247	248	การพัฒนาซอฟท์แวร์และอุปกรณ์วิเคราะห์เคมีไฟฟ้าแบบพกพาราคาถูกเพื่อการติดตามตรวจสอบสารอินทรีย์ระเหยง่ายในสิ่งแวดล้อม	2557	ผศ.ดร. ยุทธนา ตันติรุ่งโรจน์ชัย	คณะวิทยาศาสตร์และเทคโนโลยี			['การ', 'พัฒนา', 'ซอฟท์แวร์', 'และ', 'อุปกรณ์', 'วิเคราะห์', 'เคมี', 'ไฟ', 'ฟ้า', 'แบบ', 'พกพา', 'ราคา', 'ถูก', 'เพื่อ', 'การ', 'ติดตาม', 'ตรวจสอบ', 'สาร', 'อินทรีย์', 'ระเหย', 'ง่าย', 'ใน', 'สิ่ง', 'แวดล้อม']
248	249	สมบัติทางรีโอโลยีและคุณภาพทางประสาทสัมผัสของถั่วกวนจากถั่วชนิดต่างๆ และส่วนผสมสำหรับขนมไส้ถั่วกวน	2557	ผศ.ดร. บุศราภา ลีละวัฒน์	คณะวิทยาศาสตร์และเทคโนโลยี			['สมบัติ', 'ทาง', 'รีโอโลยี', 'และ', 'คุณภาพ', 'ทาง', 'ประสาท', 'สัมผัส', 'ของ', 'ถั่ว', 'กวน', 'จาก', 'ถั่ว', 'ชนิด', 'ต่างๆ', ' ', 'และ', 'ส่วน', 'ผสม', 'สำหรับ', 'ขนม', 'ไส้', 'ถั่วกวน']
249	250	ผลกระทบของเงื่อนไขการเคลือบฟิล์มต่อสมบัติทางโครงสร้างและทางแสงของกระจกปรับเปลี่ยนสภาพแสงได้ด้วยฟิล์ม Mg-Ni ที่เตรียมด้วยเทคนิคดีซี แมกนีตรอน สปัตเตอริง	2557	ผศ.ดร. กมล เอี่ยมพนากิจ	คณะวิทยาศาสตร์และเทคโนโลยี			['ผล', 'กระทบ', 'ของ', 'เงื่อนไข', 'การ', 'เคลือบ', 'ฟิล์ม', 'ต่อสมบัติ', 'ทาง', 'โครงสร้าง', 'และ', 'ทาง', 'แสง', 'ของ', 'กระจก', 'ปรับเปลี่ยน', 'สภาพ', 'แสง', 'ได้', 'ด้วย', 'ฟิล์ม', ' ', 'Mg', '-', 'Ni', ' ', 'ที่', 'เตรียม', 'ด้วย', 'เทคนิค', 'ดี', 'ซี', ' ', 'แมกนีตรอน', ' ', 'สปัตเตอริง']
250	251	ผลของสารกระตุ้นต่อปริมาณสาร diosgenin ของยอด Dioscorea birmanica ในสภาพปลอดเชื้อ	2557	รศ.ดร. เยาวพา จิระเกียรติกุล	คณะวิทยาศาสตร์และเทคโนโลยี			['ผล', 'ของ', 'สาร', 'กระตุ้น', 'ต่อ', 'ปริมาณ', 'สาร', ' ', 'diosgenin', ' ', 'ของ', 'ยอด', ' ', 'Dioscorea birmanica', ' ', 'ใน', 'สภาพ', 'ปลอด', 'เชื้อ']
251	252	การบำบัดสี Reactive จากน้ำเสียโรงงานสิ่งทอด้วยราที่แยกได้จากประเทศไทย	2557	ผศ.ดร. นิรมล ศากยวงศ์	คณะวิทยาศาสตร์และเทคโนโลยี			['การ', 'บำบัด', 'สี', ' ', 'Reactive', ' ', 'จาก', 'น้ำ', 'เสีย', 'โรง', 'งาน', 'สิ่ง', 'ทอ', 'ด้วย', 'รา', 'ที่', 'แยก', 'ได้', 'จาก', 'ประเทศไทย']
252	253	การใช้แบคทีเรียบำบัดน้ำเสียสีจากการฟอกย้อม	2557	ผศ.ดร. ธีระชัย  ธนานันต์	คณะวิทยาศาสตร์และเทคโนโลยี			['การ', 'ใช้', 'แบคทีเรีย', 'บำบัด', 'น้ำ', 'เสีย', 'สี', 'จาก', 'การ', 'ฟอก', 'ย้อม']
253	254	การศึกษาสมบัติของฟิล์มบางโพลีอะนิลีนสำหรับการประยุกต์ใช้เป็นตัวตรวจรู้แก๊ส	2557	อ.ดร. เรวัตร ใจสุทธิ	คณะวิทยาศาสตร์และเทคโนโลยี			['การ', 'ศึกษา', 'สมบัติ', 'ของ', 'ฟิล์ม', 'บาง', 'โพลี', 'อะนิลีน', 'สำหรับ', 'การ', 'ประยุกต์', 'ใช้', 'เป็น', 'ตัว', 'ตรวจ', 'รู้', 'แก๊ส']
254	255	การใช้ประโยชน์จากเถ้าที่ได้จากการไพโรไลซิสยางรถยนต์ใช้แล้ว : การผลิตตัวดูดซับและการใช้เป็นสารตัวเติมในคอมพอสิตยางธรรมชาติ	2557	รศ.ดร. ภาณุ ด่านวานิชกุล	คณะวิศวกรรมศาสตร์			['การ', 'ใช้', 'ประโยชน์', 'จาก', 'เถ้าที่', 'ได้', 'จาก', 'การ', 'ไพโรไลซิสยาง', 'รถ', 'ยนต์', 'ใช้', 'แล้ว', ' ', ':', ' ', 'การ', 'ผลิต', 'ตัว', 'ดูดซับ', 'และ', 'การ', 'ใช้', 'เป็น', 'สารตัว', 'เติม', 'ใน', 'คอมพอสิตยาง', 'ธรรมชาติ']
255	256	การแตกหักจากความเค้นร่วมกับการกัดกร่อนของโลหะผสมทองแดง-นิเกิล-อลูมิเนียมในน้ำทะเล	2557	รศ.ดร. ชาวสวน กาญจโนมัย	คณะวิศวกรรมศาสตร์			['การ', 'แตก', 'หัก', 'จาก', 'ความ', 'เค้น', 'ร่วม', 'กับ', 'การ', 'กัดกร่อน', 'ของ', 'โลหะ', 'ผสม', 'ทองแดง', '-', 'นิเกิล', '-', 'อลูมิเนียม', 'ใน', 'น้ำ', 'ทะเล']
256	257	การศึกษาและทำนายโครงสร้างและขนาดโมเลกุลของยางธรรมชาติหลังการบดผสมโดยใช้ศาสตร์ทางรีโอโลยี	2557	รศ.ดร. แคทลียา ปัทมพรหม	คณะวิศวกรรมศาสตร์			['การ', 'ศึกษา', 'และ', 'ทำ', 'นาย', 'โครงสร้าง', 'และ', 'ขนาด', 'โมเลกุล', 'ของ', 'ยาง', 'ธรรมชาติ', 'หลัง', 'การ', 'บด', 'ผสม', 'โดย', 'ใช้', 'ศาสตร์', 'ทาง', 'รีโอโลยี']
257	258	ผลกระทบของความหนืดและการไหลของเลือดต่อไขมันอุดตันในหลอดเลือด	2557	รศ.ดร. วิโรจน์ ลิ่มตระการ	คณะวิศวกรรมศาสตร์			['ผล', 'กระทบ', 'ของ', 'ความ', 'หนืด', 'และ', 'การ', 'ไหล', 'ของ', 'เลือด', 'ต่อ', 'ไขมัน', 'อุดตัน', 'ใน', 'หลอด', 'เลือด']
258	259	การสังเคราะห์วัสดุแลกเปลี่ยนประจุลบเพื่อใช้ในการบำบัดน้ำเสียจากยางรถยนต์ใช้แล้วโดยการให้ความร้อนด้วยไมโครเวฟ	2557	ผศ.ดร. สุพิชชา  รุ่งโรจน์นิมิตชัย	คณะวิศวกรรมศาสตร์			['การ', 'สังเคราะห์', 'วัสดุ', 'แลกเปลี่ยน', 'ประจุ', 'ลบ', 'เพื่อ', 'ใช้', 'ใน', 'การ', 'บำบัด', 'น้ำ', 'เสีย', 'จาก', 'ยาง', 'รถ', 'ยนต์', 'ใช้', 'แล้ว', 'โดย', 'การ', 'ให้', 'ความ', 'ร้อน', 'ด้วย', 'ไมโครเวฟ']
259	260	งานวิจัยและพัฒนาเครื่องต้นแบบการบำบัดเนื้อเยื่อโดยใช้คลื่นแม่เหล็กไฟฟ้าผ่านท่อ Antenna	2557	อ.ดร. สมศักดิ์ วงษ์ประดับไชย	คณะวิศวกรรมศาสตร์			['งานวิจัยและ', 'พัฒนา', 'เครื่อง', 'ต้น', 'แบบ', 'การ', 'บำบัด', 'เนื้อเยื่อ', 'โดย', 'ใช้', 'คลื่น', 'แม่เหล็ก', 'ไฟ', 'ฟ้า', 'ผ่าน', 'ท่อ', ' ', 'Antenna']
260	261	การศึกษาการกัดกร่อนของคอนกรีตในสภาวะกรดและการประเมินอายุการใช้งานโครงสร้างคอนกรีตที่ถูกกรดกัดกร่อน	2557	ศ. สมนึก ตั้งเติมสิริกุล	สถาบันเทคโนโลยีนานาชาติสิรินธร			['การ', 'ศึกษา', 'การ', 'กัดกร่อน', 'ของ', 'คอนกรีต', 'ใน', 'สภาวะ', 'กรด', 'และ', 'การ', 'ประเมิน', 'อายุ', 'การ', 'ใช้', 'งาน', 'โครงสร้าง', 'คอนกรีต', 'ที่', 'ถูก', 'กรด', 'กัดกร่อน']
261	262	การพัฒนาอนุภาคแม่เหล็กขนาดนาโนเมตรเคลือบด้วยสารดูดซับกลุ่มซีโอไลท์เพื่อใช้ในการบำบัดน้ำและสิ่งแวดล้อมที่ถูกปนเปื้อนด้วยโลหะหนัก	2557	รศ.ดร. ปกรณ์ โอภาประกาสิต	สถาบันเทคโนโลยีนานาชาติสิรินธร			['การ', 'พัฒนา', 'อนุภาค', 'แม่', 'เหล็ก', 'ขนาด', 'นาโนเมตร', 'เคลือบ', 'ด้วย', 'สาร', 'ดูดซับ', 'กลุ่ม', 'ซีโอไลท์', 'เพื่อ', 'ใช้', 'ใน', 'การ', 'บำบัด', 'น้ำ', 'และสิ่ง', 'แวดล้อม', 'ที่', 'ถูก', 'ปนเปื้อน', 'ด้วย', 'โลหะ', 'หนัก']
262	263	การพัฒนาสารสกัดตำรับสหัสธาราเพื่อใช้เป็นยารักษาผู้ป่วยโรคข้อเสื่อม	2557	รศ.ดร. อรุณพร อิฐรัตน์	คณะแพทยศาสตร์			['การ', 'พัฒนา', 'สารสกัด', 'ตำรับ', 'สหัส', 'ธารา', 'เพื่อ', 'ใช้', 'เป็น', 'ยา', 'รักษา', 'ผู้', 'ป่วย', 'โรค', 'ข้อ', 'เสื่อม']
263	264	ประสิทธิภาพของการกำจัดเชื้อ เฮลิโคแบคเตอร์ ไพโลไร ด้วยสูตรยา bismuth-based high dose PPI triple therapy 7 วัน และ 14 วันในผู้ป่วยไทยโรค non ulcer dyspepsia	2557	ผศ.ดร.นพ. รัฐกร วิไลชนม์	คณะแพทยศาสตร์			['ประสิทธิภาพ', 'ของ', 'การ', 'กำจัด', 'เชื้อ', ' ', 'เฮลิโคแบคเตอร์ ไพโลไร', ' ', 'ด้วย', 'สูตร', 'ยา', ' ', 'bismuth', '-', 'based', ' ', 'high', ' ', 'dose', ' ', 'PPI', ' ', 'triple', ' ', 'therapy', ' ', '7', ' ', 'วัน', ' ', 'และ', ' ', '14', ' ', 'วัน', 'ใน', 'ผู้', 'ป่วย', 'ไทย', 'โรค', ' ', 'non', ' ', 'ulcer', ' ', 'dyspepsia']
264	265	ฤทธิ์ของสารสกัดจากมะม่วง มะพร้าว และมะเฟือง ต่อการป้องกันเซลล์ผิวหนังชนิดเคอราติโนไซต์จากการถูกทำลายโดยรังสีอัลตราไวโอเลตบี	2557	ผศ.ดร. ชาลินี รอนไพริน	คณะแพทยศาสตร์			['ฤทธิ์', 'ของ', 'สาร', 'สกัด', 'จาก', 'มะม่วง', ' ', 'มะพร้าว', ' ', 'และ', 'มะเฟือง', ' ', 'ต่อ', 'การ', 'ป้องกัน', 'เซลล์', 'ผิวหนัง', 'ชนิด', 'เคอราติโนไซต์', 'จาก', 'การ', 'ถูก', 'ทำลาย', 'โดย', 'รังสี', 'อัลตราไวโอเลตบี']
265	266	การพัฒนาสายพันธุ์เซลล์ต้นกำเนิดจากตัวอ่อนที่ได้มาจากไข่ที่มีการปฏิสนธิกับอสุจิล้มเหลว (failed fertilization oocyte), ไข่ที่เจริญไม่เต็มที่ (immature oocyte), ไข่ที่มีการปฏิสนธิผิดปกติและไข่ที่ปฏิสนธิแต่หยุดการเจริญเติบโตในระยะ zygote	2557	รศ.นพ. เจริญไชย เจียมจรรยา	คณะแพทยศาสตร์			['การ', 'พัฒนา', 'สายพันธุ์', 'เซลล์', 'ต้น', 'กำเนิด', 'จาก', 'ตัว', 'อ่อน', 'ที่', 'ได้', 'มา', 'จาก', 'ไข่', 'ที่', 'มี', 'การ', 'ปฏิสนธิ', 'กับ', 'อสุจิล้มเหลว', ' ', '(', 'failed', ' ', 'fertilization', ' ', 'oocyte', ')', ',', ' ', 'ไข่', 'ที่', 'เจริญ', 'ไม่', 'เต็มที่', ' ', '(', 'immature', ' ', 'oocyte', ')', ',', ' ', 'ไข่', 'ที่', 'มี', 'การ', 'ปฏิสนธิ', 'ผิด', 'ปกติ', 'และ', 'ไข่', 'ที่', 'ปฏิสนธิ', 'แต่', 'หยุด', 'การ', 'เจริญเติบโต', 'ใน', 'ระยะ', ' ', 'zygote']
