	Unnamed: 0	id	name	year	start_date	end_date	status	title	first_name	last_name	granter	tokenized_title
1248	1248	1250	อบรมและศึกษาดูงานหลักสูตร การจัดการความรู้เพื่อการพัฒนาท้องถิ่น  	2555	22/3/2012 	7/4/2012 	ปิดโครงการ 	รองศาสตราจารย์ ดร.	 โคริน	 เฟื่องเกษม  	องค์กรปกครองส่วนท้องถิ่นจังหวัดสระแก้ว 	['อบรม', 'และ', 'ศึกษา', 'ดู', 'งาน', 'หลักสูตร', ' ', 'การ', 'จัดการ', 'ความ', 'รู้', 'เพื่อ', 'การ', 'พัฒนา', 'ท้องถิ่น', '\xa0', ' ']
1249	1249	1251	อบรมสัมมนาหลักสูตร การเสริมสร้างประสิทธิภาพทีมงานบุคลากรด้านกฎหมายและหน่วยงานที่เกี่ยวข้อง  	2555	16/12/2011 	18/12/2011 	ปิดโครงการ 	รองศาสตราจารย์ ดร.	 ไตรรัตน์ 	 โภคพลากรณ์  	กรมสรรพสามิต 	['อบรม', 'สัมมนา', 'หลักสูตร', ' ', 'การ', 'เสริมสร้าง', 'ประสิทธิภาพ', 'ทีม', 'งาน', 'บุคลากร', 'ด้าน', 'กฎหมาย', 'และ', 'หน่วย', 'งาน', 'ที่', 'เกี่ยวข้อง', '\xa0', ' ']
1250	1250	1252	ฝึกอบรมหลักสูตรนักบริหารระดับกลาง รุ่นที่ 1  	2555	30/1/2012 	24/2/2012 	ปิดโครงการ 	รองศาสตราจารย์ ดร.	 ไตรรัตน์	โภคพลากรณ์  	กรมสรรพากร 	['ฝึกอบรม', 'หลักสูตร', 'นัก', 'บริหาร', 'ระดับ', 'กลาง', ' ', 'รุ่น', 'ที่', ' ', '1', '\xa0', ' ']
1251	1251	1253	ฝึกอบรมหลักสูตรนักบริหารระดับกลาง รุ่นที่ 2  	2555	ฝึกอบรมหลักสูตรนักบริหารระดับกลาง รุ่นที่ 2  	2/3/2012 	ปิดโครงการ 	รองศาสตราจารย์ ดร.	 ไตรรัตน์	 โภคพลากรณ์  	กรมสรรพากร 	['ฝึกอบรม', 'หลักสูตร', 'นัก', 'บริหาร', 'ระดับ', 'กลาง', ' ', 'รุ่น', 'ที่', ' ', '2', '\xa0', ' ']
1252	1252	1254	ฝึกอบรมหลักสูตรนักบริหารระดับกลาง รุ่นที่ 5  	2555	11/6/2012 	6/7/2012 	ปิดโครงการ 	รองศาสตราจารย์ ดร.	ไดรรรัตน์ 	 โภคพลากรณ์  	กรมสรรพากร 	['ฝึกอบรม', 'หลักสูตร', 'นัก', 'บริหาร', 'ระดับ', 'กลาง', ' ', 'รุ่น', 'ที่', ' ', '5', '\xa0', ' ']
1253	1253	1255	ฝึกอบรมหลักสูตร การสร้างและพัฒนาทีมงานเพื่อเพิ่มประสิทธิภาพการทำงานสำนักบริหารการคลังและรายได้  	2555	15/3/2012 	18/3/2012 	ปิดโครงการ 	รองศาสตราจารย์ ดร.	 ไตรรัตน์ 	 โภคพลากรณ์  	กรมสรรพสามิต 	['ฝึกอบรม', 'หลักสูตร', ' ', 'การ', 'สร้าง', 'และ', 'พัฒนา', 'ทีม', 'งาน', 'เพื่อ', 'เพิ่ม', 'ประสิทธิภาพ', 'การ', 'ทำ', 'งาน', 'สำนักบริหารการ', 'คลัง', 'และ', 'ราย', 'ได้', '\xa0', ' ']
1254	1254	1256	สัมมนาหลักสูตร ระเบียบกรมสรรพสามิตว่าด้วยการตรวจสอบภาษีสรรพสามิตตามพระราชบัญญัติภาษีสรรพสามิต พ.ศ.2527 พ.ศ.2553 และเทคนิคการปฏิบัติงานตรวจสอบภาษี รุ่นที่ 1  	2555	23/4/2012 	27/4/2012 	ปิดโครงการ 	รองศาสตราจารย์ ดร.	 ไตรรัตน์	 โภคพลากรณ์  	กรมสรรพสามิต 	['สัมมนา', 'หลักสูตร', ' ', 'ระเบียบ', 'กรม', 'สรรพสามิต', 'ว่า', 'ด้วย', 'การ', 'ตรวจสอบ', 'ภาษี', 'สรรพสามิต', 'ตาม', 'พระราชบัญญัติ', 'ภาษี', 'สรรพสามิต', ' ', 'พ.ศ.', '2527', ' ', 'พ.ศ.', '2553', ' ', 'และ', 'เทคนิค', 'การ', 'ปฏิบัติ', 'งาน', 'ตรวจสอบ', 'ภาษี', ' ', 'รุ่น', 'ที่', ' ', '1', '\xa0', ' ']
1255	1255	1258	สัมมนาหลักสูตร ระเบียบกรมสรรพสามิตว่าด้วยการตรวจสอบภาษีสรรพสามิตตามพระราชบัญญัติภาษีสรรพสามิต พ.ศ.2527 พ.ศ.2553 และเทคนิคการปฏิบัติงานตรวจสอบภาษี รุ่นที่2 	2555	21/5/2012	25/5/2012	ปิดโครงการ	รองศาสตราจารย์ ดร.	 ไตรรัตน์ 	 โภคพลากรณ์ 	กรมสรรพสามิต	['สัมมนา', 'หลักสูตร', ' ', 'ระเบียบ', 'กรม', 'สรรพสามิต', 'ว่า', 'ด้วย', 'การ', 'ตรวจสอบ', 'ภาษี', 'สรรพสามิต', 'ตาม', 'พระราชบัญญัติ', 'ภาษี', 'สรรพสามิต', ' ', 'พ.ศ.', '2527', ' ', 'พ.ศ.', '2553', ' ', 'และ', 'เทคนิค', 'การ', 'ปฏิบัติ', 'งาน', 'ตรวจสอบ', 'ภาษี', ' ', 'รุ่น', 'ที่', '2', '\xa0']
1256	1256	1259	สัมมนาหลักสูตร ระเบียบกรมสรรพสามิตว่าด้วยการตรวจสอบภาษีสรรพสามิตตามพระราชบัญญัติภาษีสรรพสามิต พ.ศ.2527 พ.ศ.2553 และเทคนิคการปฏิบัติงานตรวจสอบภาษี รุ่นที่3 	2555	9/7/2012	13/7/2012	ปิดโครงการ	รองศาสตราจารย์ ดร.	 ไตรรัตน์ 	โภคพลากรณ์ 	กรมสรรพสามิต	['สัมมนา', 'หลักสูตร', ' ', 'ระเบียบ', 'กรม', 'สรรพสามิต', 'ว่า', 'ด้วย', 'การ', 'ตรวจสอบ', 'ภาษี', 'สรรพสามิต', 'ตาม', 'พระราชบัญญัติ', 'ภาษี', 'สรรพสามิต', ' ', 'พ.ศ.', '2527', ' ', 'พ.ศ.', '2553', ' ', 'และ', 'เทคนิค', 'การ', 'ปฏิบัติ', 'งาน', 'ตรวจสอบ', 'ภาษี', ' ', 'รุ่น', 'ที่', '3', '\xa0']
1257	1257	1260	สัมมนาหลักสูตร ระเบียบกรมสรรพสามิตว่าด้วยการตรวจสอบภาษีสรรพสามิตตามพระราชบัญญัติภาษีสรรพสามิต พ.ศ.2527 พ.ศ.2553 และเทคนิคการปฏิบัติงานตรวจสอบภาษี รุ่นที่ 4 	2555	17/7/2012	20/7/2012	ปิดโครงการ	รองศาสตราจารย์ ดร.	 ไตรรัตน์	โภคพลากรณ์ 	กรมสรรพสามิต	['สัมมนา', 'หลักสูตร', ' ', 'ระเบียบ', 'กรม', 'สรรพสามิต', 'ว่า', 'ด้วย', 'การ', 'ตรวจสอบ', 'ภาษี', 'สรรพสามิต', 'ตาม', 'พระราชบัญญัติ', 'ภาษี', 'สรรพสามิต', ' ', 'พ.ศ.', '2527', ' ', 'พ.ศ.', '2553', ' ', 'และ', 'เทคนิค', 'การ', 'ปฏิบัติ', 'งาน', 'ตรวจสอบ', 'ภาษี', ' ', 'รุ่น', 'ที่', ' ', '4', '\xa0']
1258	1258	1261	ฝึกอบรมหลักสูตร นักบริหารการจัดเก็บภาษีสรรพสามิตระดับสูง (Excise Tax Administration for Top Executive :ETATE) 	2555	6/6/2012	17/6/2012	ปิดโครงการ	รองศาสตราจารย์ ดร.	 ไตรรัตน์	โภคพลากรณ์ 	กรมสรรพสามิต	['ฝึกอบรม', 'หลักสูตร', ' ', 'นัก', 'บริหาร', 'การ', 'จัด', 'เก็บ', 'ภาษี', 'สรรพสามิต', 'ระดับ', 'สูง', ' ', '(', 'Excise', ' ', 'Tax', ' ', 'Administration', ' ', 'for', ' ', 'Top', ' ', 'Executive', ' ', ':', 'ETATE', ')', '\xa0']
1259	1259	1262	สัมมนาหลักสูตรการดำเนินการด้วยความรับผิดชอบต่อสังคม (Corporate Social Responsibility : CSR) 	2555	24/6/2012	26/6/2012	ปิดโครงการ	รองศาสตราจารย์ ดร.	 ไตรรัตน์ 	 โภคพลากรณ์ 	กรมสรรพากร	['สัมมนา', 'หลักสูตร', 'การ', 'ดำเนิน', 'การ', 'ด้วย', 'ความ', 'รับผิดชอบ', 'ต่อ', 'สังคม', ' ', '(', 'Corporate', ' ', 'Social', ' ', 'Responsibility', ' ', ':', ' ', 'CSR', ')', '\xa0']
1260	1260	1263	สัมมนาหลักสูตร การสร้างและพัฒนาทีมงานเพื่อเพิ่มประสิทธิภาพการทำงานสำนักบริหารการคลังและรายได้ 	2555	1/3/2012	30/3/2012	ปิดโครงการ	รองศาสตราจารย์ ดร.	 ไตรรัตน์ 	 โภคพลากรณ์ 	กรมสรรพสามิต	['สัมมนา', 'หลักสูตร', ' ', 'การ', 'สร้าง', 'และ', 'พัฒนา', 'ทีม', 'งาน', 'เพื่อ', 'เพิ่ม', 'ประสิทธิภาพ', 'การ', 'ทำ', 'งาน', 'สำนักบริหารการ', 'คลัง', 'และ', 'ราย', 'ได้', '\xa0']
1261	1261	1264	งานทดสอบการรับน้ำหนักบรรทุกสะพานอนุรักษ์ 11 สะพาน 	2555	2/4/2012	16/6/2012	ปิดโครงการ	ผู้ช่วยศาสตราจารย์ ดร.	 กฤดายุทธ์ 	 ชมภูมิ่ง 	มหาวิทยาลัยเทคโนโลยีพระจอมเกล้าพระนครเหนือ	['งาน', 'ทดสอบ', 'การ', 'รับ', 'น้ำหนัก', 'บรรทุก', 'สะพานอนุรักษ์', ' ', '11', ' ', 'สะพาน', '\xa0']
1262	1262	1265	ดำเนินการตามแผนสืบทอดตำแหน่งของสำนักงานปลัดกระทรวงการคลังทบทวนแผนพัฒนารายบุคคล บททวนกำหนดตัวชี้วัดรายบุคคลและการประเมินผลการปฏิบัติราชการ ประจำปีงบประมาณ พ.ศ.2555 	2555	29/3/2012	24/12/2012	ปิดโครงการ	ผู้ช่วยศาสตราจารย์ ดร.	กังวาน 	 ยอดวิศิษฎ์ศักดิ์ 	สำนักงานปลัดกระทรวงการคลัง	['ดำเนินการ', 'ตาม', 'แผน', 'สืบทอดตำแหน่ง', 'ของ', 'สำนักงานปลัดกระทรวงการคลัง', 'ทบทวน', 'แผน', 'พัฒนา', 'ราย', 'บุคคล', ' ', 'บททวน', 'กำหนด', 'ตัว', 'ชี้', 'วัด', 'ราย', 'บุคคล', 'และ', 'การ', 'ประเมิน', 'ผล', 'การ', 'ปฏิบัติ', 'ราชการ', ' ', 'ประจำ', 'ปี', 'งบ', 'ประมาณ', ' ', 'พ.ศ.', '2555', '\xa0']
1263	1263	1266	การเสริมสร้างความพึงพอใจของพนักงานและความผูกพันต่อองค์กรประจำปี 2555 	2555	29/2/2012	4/12/2012	ปิดโครงการ	ผู้ช่วยศาสตราจารย์ ดร.	 กังวาน 	 ยอดวิศิษฎ์ศักดิ์ 	การไฟฟ้านครหลวง	['การ', 'เสริมสร้าง', 'ความ', 'พึงพอใจ', 'ของ', 'พนักงาน', 'และ', 'ความ', 'ผูกพัน', 'ต่อ', 'องค์กร', 'ประจำ', 'ปี', ' ', '2555', '\xa0']
1264	1264	1267	วิเคราะห์กำหนดแผนอัตรากำลังคน (Manpower Planning) และจัดทำแบบ บรรยายลักษณะงาน (Job Description) ของสำนักงานการปฏิรูปที่ดินเพื่อเกษตรกรรม 	2555	30/8/2012	27/3/2013	ปิดโครงการ	ผู้ช่วยศาสตราจารย์ ดร.	 กังวาน	ยอดวิศิษฎ์ศักดิ์ 	สำนักงานการปฏิรูปที่ดินเพื่อเกษตรกรรม	['วิเคราะห์', 'กำหนด', 'แผน', 'อัตรา', 'กำลัง', 'คน', ' ', '(', 'Manpower', ' ', 'Planning', ')', ' ', 'และ', 'จัดทำ', 'แบบ', ' ', 'บรรยาย', 'ลักษณะ', 'งาน', ' ', '(', 'Job', ' Description', ')', ' ', 'ของ', 'สำนักงานการปฏิรูป', 'ที่ดิน', 'เพื่อ', 'เกษตรกรรม', '\xa0']
1265	1265	1269	พัฒนาระบบสารสนเทศสนับสนุนโครงการรากฟันเทียมเฉลิมพระเกียรติ พระบาทสมเด็จพระเจ้าอยู่หัว เนื่องในโอกาสพระราชพิธีมหามงคลเฉลิมพระชนมพรรษา 7 รอบ 5 ธันวาคม 2554 	2555	1/6/2012	27/12/2012	ปิดโครงการ	รองศาสตราจารย์ ดร.	 จิรรัตน์	 ธีระวราพฤกษ์ 	มูลนิธิทันตนวัตกรรม ในพระบรมราชูปถัมภ์	['พัฒนา', 'ระบบ', 'สารสนเทศ', 'สนับสนุน', 'โครงการ', 'ราก', 'ฟัน', 'เทียม', 'เฉลิม', 'พระเกียรติ', ' ', 'พระบาทสมเด็จพระเจ้าอยู่หัว', ' ', 'เนื่อง', 'ใน', 'โอกาส', 'พระราชพิธี', 'มหามงคล', 'เฉลิม', 'พระชนมพรรษา', ' ', '7', ' ', 'รอบ', ' ', '5', ' ', 'ธันวาคม', ' ', '2554', '\xa0']
1266	1266	1272	การกำหนดราคาบังคับขายทอดตลาดทรัพย์สิน 	2555	26/12/2011	22/8/2012	ปิดโครงการ	ผู้ช่วยศาสตราจารย์ ดร.	 จิตตาภรณ์	 ศรีบุญจิตต์ 	กรมบังคับคดี	['การ', 'กำหนด', 'ราคา', 'บังคับ', 'ขาย', 'ทอด', 'ตลาด', 'ทรัพย์สิน', '\xa0']
1267	1267	1274	ที่ปรึกษาเพื่อปรับปรุงระบบบริหารโครงการลงทุนของ กทท. 	2555	28/12/2011	26/6/2012	ปิดโครงการ	ผู้ช่วยศาสตราจารย์ ดร.	 จิตตาภรณ์	 ศรีบุญจิตต์ 	การท่าเรือแห่งประเทศไทย	['ที่ปรึกษา', 'เพื่อ', 'ปรับปรุง', 'ระบบ', 'บริหาร', 'โครงการ', 'ลง', 'ทุน', 'ของ', ' ', 'กทท.', '\xa0']
1268	1268	1275	การประเมินราคาทรัพย์สิน 	2555	11/6/2012	28/6/2012	ปิดโครงการ	ผู้ช่วยศาสตราจารย์ ดร.	 จิตตาภรณ์	 ศรีบุญจิตต์ 	กรมธนารักษ์	['การ', 'ประเมิน', 'ราคา', 'ทรัพย์สิน', '\xa0']
1269	1269	1276	พัฒนาฐานข้อมูล และระบบสารสนเทศเพื่อสนับสนุนการวิเคราะห์กลั่นกรองโครงการภายใต้การดำเนินงานตามกลไกการพัฒนาที่สะอาด สำหรับโครงการกลไกการพัฒนาที่สะอาดแบบควบรวม(Bundling) และ แบบแผนโครงการ (Programme of Activities : PoA) 	2555	1/5/2012	30/4/2013	ปิดโครงการ	รองศาสตราจารย์ ดร.	 จิรรัตน์	 ธีระวราพฤกษ์ 	องค์การบริหารจัดการก๊าซเรือนกระจก (องค์การมหาชน) (TGO)	['พัฒนา', 'ฐาน', 'ข้อมูล', ' ', 'และ', 'ระบบ', 'สารสนเทศ', 'เพื่อ', 'สนับสนุน', 'การ', 'วิเคราะห์', 'กลั่นกรอง', 'โครงการ', 'ภาย', 'ใต้', 'การ', 'ดำเนิน', 'งาน', 'ตาม', 'กลไก', 'การ', 'พัฒนา', 'ที่', 'สะอาด', ' ', 'สำหรับ', 'โครงการ', 'กลไก', 'การ', 'พัฒนา', 'ที่', 'สะอาด', 'แบบ', 'ควบรวม', '(', 'Bundling', ')', ' ', 'และ', ' ', 'แบบแผน', 'โครงการ', ' ', '(', 'Programme', ' ', 'of', ' ', 'Activities', ' ', ':', ' ', 'PoA', ')', '\xa0']
1270	1270	1277	ประเมินผลงานและทบทวนแผนแม่บททางด้านเทคโนโลยีสารสนเทศ 	2555	18/5/2012	14/9/2012	ปิดโครงการ	รองศาสตราจารย์ ดร.	 จิรศิริพงศ์ 	 เจริญภัณฑารักษ์ 	การกีฬาแห่งประเทศไทย	['ประเมิน', 'ผล', 'งาน', 'และ', 'ทบทวน', 'แผนแม่บท', 'ทาง', 'ด้าน', 'เทคโนโลยีสารสนเทศ', '\xa0']
1271	1271	1278	พัฒนาระบบบริหารความต่อเนื่องทางธุรกิจ 	2555	30/5/2012	30/5/2012	ปิดโครงการ	รองศาสตราจารย์ ดร.	 จิรศิริพงศ์ 	 เจริญภัณฑารักษ์ 	การไฟฟ้าส่วนภูมิภาค	['พัฒนา', 'ระบบ', 'บริหาร', 'ความ', 'ต่อเนื่อง', 'ทาง', 'ธุรกิจ', '\xa0']
1272	1272	1279	การศึกษาโอกาสทางการค้าอัญมณีและเครื่องประดับไทยในตลาดรัสเซีย 	2555	1/8/2012	31/5/2013	ปิดโครงการ	รองศาสตราจารย์ ดร.	 ชนินทร์	มีโภคี 	สถาบันวิจัยและพัฒนาอัญมณีและเครื่องประดับแห่งชาติ (องค์การมหาชน)	['การ', 'ศึกษา', 'โอกาส', 'ทาง', 'การ', 'ค้า', 'อัญมณี', 'และ', 'เครื่อง', 'ประดับ', 'ไทย', 'ใน', 'ตลาดรัสเซีย', '\xa0']
1273	1273	1280	ศึกษาวิจัยและพัฒนาวิถีชีวิตและบทบาทของชุมชนในพื้นที่วิกฤติอุทกภัย : กรณีศึกษาลุ่มน้ำภาคใต้ 	2555	10/8/2012	9/8/2013	ปิดโครงการ	รองศาสตราจารย์ ดร.	 ชวลิต 	 ชาลีรักษ์ตระกูล 	กรมทรัพยากรน้ำ	['ศึกษา', 'วิจัย', 'และ', 'พัฒนา', 'วิถี', 'ชีวิต', 'และ', 'บทบาท', 'ของ', 'ชุมชน', 'ใน', 'พื้นที่', 'วิกฤติ', 'อุทกภัย', ' ', ':', ' ', 'กรณี', 'ศึกษา', 'ลุ่มน้ำภาคใต้', '\xa0']
1274	1274	1282	เสริมขีดความสามารถในการเป็นองค์กรชั้นนำด้านการพัฒนาระบบรถไฟฟ้าขนส่งมวลชนของประเทศ 	2555	17/1/2012	31/8/2012	ปิดโครงการ	รองศาสตราจารย์	ทวีป 	 ชัยสมภพ 	การรถไฟฟ้าขนส่งมวลชนแห่งประเทศไทย	['เสริม', 'ขีด', 'ความ', 'สามารถ', 'ใน', 'การ', 'เป็น', 'องค์กร', 'ชั้น', 'นำ', 'ด้าน', 'การ', 'พัฒนา', 'ระบบ', 'รถ', 'ไฟ', 'ฟ้า', 'ขนส่ง', 'มวล', 'ชน', 'ของ', 'ประเทศ', '\xa0']
1275	1275	1284	ศึกษาระบบจดทะเบียนนิติบุคคลทางอิเล็กทรอนิกส์ (e-Registration) 	2555	29/2/2012	26/9/2012	ปิดโครงการ	อาจารย์ ดร.	 ชุมพล	 บุญมี 	กรมพัฒนาธุรกิจการค้า	['ศึกษา', 'ระบบ', 'จด', 'ทะเบียน', 'นิติบุคคล', 'ทาง', 'อิเล็กทรอนิกส์', ' ', '(', 'e', '-', 'Registration', ')', '\xa0']
1276	1276	1285	ศึกษาวิจัยและจัดทำข้อกำหนดการพัฒนาเว็บท่า (Web portal) สำหรับประชาสัมพันธ์ศิลปวัฒนธรรมไทยของกระทรวงวัฒนธรรม 	2555	23/1/2012	24/3/2012	ปิดโครงการ	ศาสตราจารย์ ดร.	 ธนารักษ์	 ธีระมั่นคง 	สำนักงานปลัดกระทรวงวัฒนธรรม	['ศึกษา', 'วิจัย', 'และ', 'จัดทำ', 'ข้อ', 'กำหนด', 'การ', 'พัฒนา', 'เว็บท่า', ' ', '(', 'Web', ' ', 'portal', ')', ' ', 'สำหรับ', 'ประชาสัมพันธ์', 'ศิลปวัฒนธรรม', 'ไทย', 'ของ', 'กระทรวงวัฒนธรรม', '\xa0']
1277	1277	1286	ทดสอบประสิทธิภาพในการรับน้ำหนักบรรทุกเพิ่มเติมของโครงถักหลังคาโถงทางเข้าโรงแรมโซฟิเทล เซ็นทาราแกรนด์ 	2555	25/11/2011	25/12/2011	ปิดโครงการ	รองศาสตราจารย์ ดร.	 นคร	 ภู่วโรดม 	โรงแรมโซฟิเทล เซ็นทาราแกรนด์	['ทดสอบ', 'ประสิทธิภาพ', 'ใน', 'การ', 'รับ', 'น้ำหนัก', 'บรรทุก', 'เพิ่มเติม', 'ของ', 'โครงถัก', 'หลังคา', 'โถง', 'ทาง', 'เข้า', 'โรง', 'แรมโซฟิเทล', ' ', 'เซ็นทาราแกรนด์', '\xa0']
